<?xml version="1.0" encoding="UTF-8"?>
<!DOCTYPE LIST [
<!-- 2006/02/11 -->
<!ELEMENT LIST (ITEM*)>
<!ELEMENT ITEM (ARG*)>
<!ELEMENT ARG (#PCDATA)>
<!ATTLIST ITEM KEY CDATA #REQUIRED>
<!ATTLIST ITEM ACTION CDATA #IMPLIED>
<!ATTLIST LIST KEY CDATA #IMPLIED>
]>

<LIST>
    <ITEM KEY="LaTeX_Document_Macro">LaTeX/Document/iTM2ActionsIndex.xml</ITEM>
    <ITEM KEY="part">LaTeX/Document/iTM2ActionsIndex.xml</ITEM>
    <ITEM KEY="chapter">LaTeX/Document/iTM2ActionsIndex.xml</ITEM>
    <ITEM KEY="section">LaTeX/Document/iTM2ActionsIndex.xml</ITEM>
    <ITEM KEY="subsection">LaTeX/Document/iTM2ActionsIndex.xml</ITEM>
    <ITEM KEY="subsubsection">LaTeX/Document/iTM2ActionsIndex.xml</ITEM>
    <ITEM KEY="paragraph">LaTeX/Document/iTM2ActionsIndex.xml</ITEM>
    <ITEM KEY="subparagraph">LaTeX/Document/iTM2ActionsIndex.xml</ITEM>
    <ITEM KEY="document">LaTeX/Document/iTM2ActionsIndex.xml</ITEM>
    <ITEM KEY="document/book">LaTeX/Document/iTM2ActionsIndex.xml</ITEM>
    <ITEM KEY="document/book/10pt">LaTeX/Document/iTM2ActionsIndex.xml</ITEM>
    <ITEM KEY="document/book/11pt">LaTeX/Document/iTM2ActionsIndex.xml</ITEM>
    <ITEM KEY="document/book/12pt">LaTeX/Document/iTM2ActionsIndex.xml</ITEM>
    <ITEM KEY="document/amsbook">LaTeX/Document/iTM2ActionsIndex.xml</ITEM>
    <ITEM KEY="document/amsbook/10pt">LaTeX/Document/iTM2ActionsIndex.xml</ITEM>
    <ITEM KEY="document/amsbook/11pt">LaTeX/Document/iTM2ActionsIndex.xml</ITEM>
    <ITEM KEY="document/amsbook/12pt">LaTeX/Document/iTM2ActionsIndex.xml</ITEM>
    <ITEM KEY="document/report">LaTeX/Document/iTM2ActionsIndex.xml</ITEM>
    <ITEM KEY="document/report/10pt">LaTeX/Document/iTM2ActionsIndex.xml</ITEM>
    <ITEM KEY="document/report/11pt">LaTeX/Document/iTM2ActionsIndex.xml</ITEM>
    <ITEM KEY="document/report/12pt">LaTeX/Document/iTM2ActionsIndex.xml</ITEM>
    <ITEM KEY="document/article">LaTeX/Document/iTM2ActionsIndex.xml</ITEM>
    <ITEM KEY="document/article/10pt">LaTeX/Document/iTM2ActionsIndex.xml</ITEM>
    <ITEM KEY="document/article/11pt">LaTeX/Document/iTM2ActionsIndex.xml</ITEM>
    <ITEM KEY="document/article/12pt">LaTeX/Document/iTM2ActionsIndex.xml</ITEM>
    <ITEM KEY="document/amsart">LaTeX/Document/iTM2ActionsIndex.xml</ITEM>
    <ITEM KEY="document/amsart/10pt">LaTeX/Document/iTM2ActionsIndex.xml</ITEM>
    <ITEM KEY="document/amsart/11pt">LaTeX/Document/iTM2ActionsIndex.xml</ITEM>
    <ITEM KEY="document/amsart/12pt">LaTeX/Document/iTM2ActionsIndex.xml</ITEM>
    <ITEM KEY="document/letter">LaTeX/Document/iTM2ActionsIndex.xml</ITEM>
    <ITEM KEY="document/letter/10pt">LaTeX/Document/iTM2ActionsIndex.xml</ITEM>
    <ITEM KEY="document/letter/11pt">LaTeX/Document/iTM2ActionsIndex.xml</ITEM>
    <ITEM KEY="document/letter/12pt">LaTeX/Document/iTM2ActionsIndex.xml</ITEM>
    <ITEM KEY="document/letter/macros">LaTeX/Document/iTM2ActionsIndex.xml</ITEM>
    <ITEM KEY="document/letter/macros/begin/end_doc/letter">LaTeX/Document/iTM2ActionsIndex.xml</ITEM>
    <ITEM KEY="document/letter/macros/name">LaTeX/Document/iTM2ActionsIndex.xml</ITEM>
    <ITEM KEY="document/letter/macros/address">LaTeX/Document/iTM2ActionsIndex.xml</ITEM>
    <ITEM KEY="document/letter/macros/signature">LaTeX/Document/iTM2ActionsIndex.xml</ITEM>
    <ITEM KEY="document/letter/macros/date">LaTeX/Document/iTM2ActionsIndex.xml</ITEM>
    <ITEM KEY="document/letter/macros/opening">LaTeX/Document/iTM2ActionsIndex.xml</ITEM>
    <ITEM KEY="document/letter/macros/closing">LaTeX/Document/iTM2ActionsIndex.xml</ITEM>
    <ITEM KEY="document/letter/macros/encl">LaTeX/Document/iTM2ActionsIndex.xml</ITEM>
    <ITEM KEY="document/letter/macros/cc">LaTeX/Document/iTM2ActionsIndex.xml</ITEM>
    <ITEM KEY="document/Options">LaTeX/Document/iTM2ActionsIndex.xml</ITEM>
    <ITEM KEY="document/Options/landscape">LaTeX/Document/iTM2ActionsIndex.xml</ITEM>
    <ITEM KEY="document/Options/draft">LaTeX/Document/iTM2ActionsIndex.xml</ITEM>
    <ITEM KEY="document/Options/openbib">LaTeX/Document/iTM2ActionsIndex.xml</ITEM>
    <ITEM KEY="document/Options/paper">LaTeX/Document/iTM2ActionsIndex.xml</ITEM>
    <ITEM KEY="document/Options/paper/letter_paper">LaTeX/Document/iTM2ActionsIndex.xml</ITEM>
    <ITEM KEY="document/Options/paper/legal_paper">LaTeX/Document/iTM2ActionsIndex.xml</ITEM>
    <ITEM KEY="document/Options/paper/executive_paper">LaTeX/Document/iTM2ActionsIndex.xml</ITEM>
    <ITEM KEY="document/Options/paper/a4_paper">LaTeX/Document/iTM2ActionsIndex.xml</ITEM>
    <ITEM KEY="document/Options/paper/a5_paper">LaTeX/Document/iTM2ActionsIndex.xml</ITEM>
    <ITEM KEY="document/Options/paper/B5_paper">LaTeX/Document/iTM2ActionsIndex.xml</ITEM>
    <ITEM KEY="document/Options/Dimensions">LaTeX/Document/iTM2ActionsIndex.xml</ITEM>
    <ITEM KEY="document/Options/Dimensions/pageheight">LaTeX/Document/iTM2ActionsIndex.xml</ITEM>
    <ITEM KEY="document/Options/Dimensions/topmargin">LaTeX/Document/iTM2ActionsIndex.xml</ITEM>
    <ITEM KEY="document/Options/Dimensions/headheight">LaTeX/Document/iTM2ActionsIndex.xml</ITEM>
    <ITEM KEY="document/Options/Dimensions/headsep">LaTeX/Document/iTM2ActionsIndex.xml</ITEM>
    <ITEM KEY="document/Options/Dimensions/textheight">LaTeX/Document/iTM2ActionsIndex.xml</ITEM>
    <ITEM KEY="document/Options/Dimensions/footskip">LaTeX/Document/iTM2ActionsIndex.xml</ITEM>
    <ITEM KEY="document/Options/Dimensions/pagewidth">LaTeX/Document/iTM2ActionsIndex.xml</ITEM>
    <ITEM KEY="document/Options/Dimensions/oddsidemargin">LaTeX/Document/iTM2ActionsIndex.xml</ITEM>
    <ITEM KEY="document/Options/Dimensions/evensidemargin">LaTeX/Document/iTM2ActionsIndex.xml</ITEM>
    <ITEM KEY="document/Options/Dimensions/textwidth">LaTeX/Document/iTM2ActionsIndex.xml</ITEM>
    <ITEM KEY="document/Options/Dimensions/marginparsep">LaTeX/Document/iTM2ActionsIndex.xml</ITEM>
    <ITEM KEY="document/Options/Dimensions/marginparwidth">LaTeX/Document/iTM2ActionsIndex.xml</ITEM>
    <ITEM KEY="document/Options/sides">LaTeX/Document/iTM2ActionsIndex.xml</ITEM>
    <ITEM KEY="document/Options/sides/one_side">LaTeX/Document/iTM2ActionsIndex.xml</ITEM>
    <ITEM KEY="document/Options/sides/two_sides">LaTeX/Document/iTM2ActionsIndex.xml</ITEM>
    <ITEM KEY="document/Options/columns">LaTeX/Document/iTM2ActionsIndex.xml</ITEM>
    <ITEM KEY="document/Options/columns/one_column">LaTeX/Document/iTM2ActionsIndex.xml</ITEM>
    <ITEM KEY="document/Options/columns/two_columns">LaTeX/Document/iTM2ActionsIndex.xml</ITEM>
    <ITEM KEY="document/Options/title">LaTeX/Document/iTM2ActionsIndex.xml</ITEM>
    <ITEM KEY="document/Options/title/no_title_page">LaTeX/Document/iTM2ActionsIndex.xml</ITEM>
    <ITEM KEY="document/Options/title/title_page">LaTeX/Document/iTM2ActionsIndex.xml</ITEM>
    <ITEM KEY="document/Options/equation">LaTeX/Document/iTM2ActionsIndex.xml</ITEM>
    <ITEM KEY="document/Options/equation/left">LaTeX/Document/iTM2ActionsIndex.xml</ITEM>
    <ITEM KEY="document/Options/equation/left_align">LaTeX/Document/iTM2ActionsIndex.xml</ITEM>
    <ITEM KEY="Format">LaTeX/Document/iTM2ActionsIndex.xml</ITEM>
    <ITEM KEY="Format/paragraph">LaTeX/Document/iTM2ActionsIndex.xml</ITEM>
    <ITEM KEY="Format/paragraph/indent">LaTeX/Document/iTM2ActionsIndex.xml</ITEM>
    <ITEM KEY="Format/paragraph/noindent">LaTeX/Document/iTM2ActionsIndex.xml</ITEM>
    <ITEM KEY="Format/paragraph/par">LaTeX/Document/iTM2ActionsIndex.xml</ITEM>
    <ITEM KEY="Format/paragraph/parameters">LaTeX/Document/iTM2ActionsIndex.xml</ITEM>
    <ITEM KEY="Format/paragraph/parameters/textwidth">LaTeX/Document/iTM2ActionsIndex.xml</ITEM>
    <ITEM KEY="Format/paragraph/parameters/linewidth">LaTeX/Document/iTM2ActionsIndex.xml</ITEM>
    <ITEM KEY="Format/paragraph/parameters/parindent">LaTeX/Document/iTM2ActionsIndex.xml</ITEM>
    <ITEM KEY="Format/paragraph/parameters/baselineskip">LaTeX/Document/iTM2ActionsIndex.xml</ITEM>
    <ITEM KEY="Format/paragraph/parameters/baselinestretch">LaTeX/Document/iTM2ActionsIndex.xml</ITEM>
    <ITEM KEY="Format/paragraph/parameters/parskip">LaTeX/Document/iTM2ActionsIndex.xml</ITEM>
    <ITEM KEY="Format/marginal_notes">LaTeX/Document/iTM2ActionsIndex.xml</ITEM>
    <ITEM KEY="Format/marginal_notes/marginpar">LaTeX/Document/iTM2ActionsIndex.xml</ITEM>
    <ITEM KEY="Format/marginal_notes/normalmarginpar">LaTeX/Document/iTM2ActionsIndex.xml</ITEM>
    <ITEM KEY="Format/marginal_notes/reversemarginpar">LaTeX/Document/iTM2ActionsIndex.xml</ITEM>
    <ITEM KEY="Format/marginal_notes/parameters">LaTeX/Document/iTM2ActionsIndex.xml</ITEM>
    <ITEM KEY="Format/marginal_notes/parameters/marginparwidth">LaTeX/Document/iTM2ActionsIndex.xml</ITEM>
    <ITEM KEY="Format/marginal_notes/parameters/marginparsep">LaTeX/Document/iTM2ActionsIndex.xml</ITEM>
    <ITEM KEY="Format/marginal_notes/parameters/marginparpush">LaTeX/Document/iTM2ActionsIndex.xml</ITEM>
    <ITEM KEY="Format/numbering">LaTeX/Document/iTM2ActionsIndex.xml</ITEM>
    <ITEM KEY="Format/numbering/newcounter">LaTeX/Document/iTM2ActionsIndex.xml</ITEM>
    <ITEM KEY="Format/numbering/setcounter">LaTeX/Document/iTM2ActionsIndex.xml</ITEM>
    <ITEM KEY="Format/numbering/addtocounter">LaTeX/Document/iTM2ActionsIndex.xml</ITEM>
    <ITEM KEY="Format/numbering/value">LaTeX/Document/iTM2ActionsIndex.xml</ITEM>
    <ITEM KEY="Format/numbering/the">LaTeX/Document/iTM2ActionsIndex.xml</ITEM>
    <ITEM KEY="Format/numbering/style">LaTeX/Document/iTM2ActionsIndex.xml</ITEM>
    <ITEM KEY="Format/numbering/style/arabic">LaTeX/Document/iTM2ActionsIndex.xml</ITEM>
    <ITEM KEY="Format/numbering/style/roman">LaTeX/Document/iTM2ActionsIndex.xml</ITEM>
    <ITEM KEY="Format/numbering/style/Roman">LaTeX/Document/iTM2ActionsIndex.xml</ITEM>
    <ITEM KEY="Format/numbering/style/alph">LaTeX/Document/iTM2ActionsIndex.xml</ITEM>
    <ITEM KEY="Format/numbering/style/Alph">LaTeX/Document/iTM2ActionsIndex.xml</ITEM>
    <ITEM KEY="Format/numbering/fnsymbol">LaTeX/Document/iTM2ActionsIndex.xml</ITEM>
    <ITEM KEY="Format/numbering/stepcounter">LaTeX/Document/iTM2ActionsIndex.xml</ITEM>
    <ITEM KEY="Format/numbering/refstepcounter">LaTeX/Document/iTM2ActionsIndex.xml</ITEM>
    <ITEM KEY="Format/footnote">LaTeX/Document/iTM2ActionsIndex.xml</ITEM>
    <ITEM KEY="Format/footnote/footnote">LaTeX/Document/iTM2ActionsIndex.xml</ITEM>
    <ITEM KEY="Format/footnote/footnotemark">LaTeX/Document/iTM2ActionsIndex.xml</ITEM>
    <ITEM KEY="Format/footnote/footnotetext">LaTeX/Document/iTM2ActionsIndex.xml</ITEM>
    <ITEM KEY="Format/footnote/parameters">LaTeX/Document/iTM2ActionsIndex.xml</ITEM>
    <ITEM KEY="Format/footnote/parameters/footnotesep">LaTeX/Document/iTM2ActionsIndex.xml</ITEM>
    <ITEM KEY="Format/footnote/parameters/footnoterule">LaTeX/Document/iTM2ActionsIndex.xml</ITEM>
    <ITEM KEY="Format/footnote/caption">LaTeX/Document/iTM2ActionsIndex.xml</ITEM>
    <ITEM KEY="Format/footnote/vspace">LaTeX/Document/iTM2ActionsIndex.xml</ITEM>
    <ITEM KEY="Page_Style">LaTeX/Document/iTM2ActionsIndex.xml</ITEM>
    <ITEM KEY="Page_Style/title_page">LaTeX/Document/iTM2ActionsIndex.xml</ITEM>
    <ITEM KEY="Page_Style/page_style">LaTeX/Document/iTM2ActionsIndex.xml</ITEM>
    <ITEM KEY="Page_Style/page_style/plain">LaTeX/Document/iTM2ActionsIndex.xml</ITEM>
    <ITEM KEY="Page_Style/page_style/empty">LaTeX/Document/iTM2ActionsIndex.xml</ITEM>
    <ITEM KEY="Page_Style/page_style/headings">LaTeX/Document/iTM2ActionsIndex.xml</ITEM>
    <ITEM KEY="Page_Style/page_style/myheadings">LaTeX/Document/iTM2ActionsIndex.xml</ITEM>
    <ITEM KEY="Page_Style/this_page_style">LaTeX/Document/iTM2ActionsIndex.xml</ITEM>
    <ITEM KEY="Page_Style/this_page_style/plain">LaTeX/Document/iTM2ActionsIndex.xml</ITEM>
    <ITEM KEY="Page_Style/this_page_style/empty">LaTeX/Document/iTM2ActionsIndex.xml</ITEM>
    <ITEM KEY="Page_Style/this_page_style/headings">LaTeX/Document/iTM2ActionsIndex.xml</ITEM>
    <ITEM KEY="Page_Style/this_page_style/myheadings">LaTeX/Document/iTM2ActionsIndex.xml</ITEM>
    <ITEM KEY="Page_Style/this_page_style/Left_heading">LaTeX/Document/iTM2ActionsIndex.xml</ITEM>
    <ITEM KEY="Page_Style/this_page_style/Right_heading">LaTeX/Document/iTM2ActionsIndex.xml</ITEM>
    <ITEM KEY="Page_Style/this_page_style/Both_headings">LaTeX/Document/iTM2ActionsIndex.xml</ITEM>
    <ITEM KEY="Page_Style/page_numbering">LaTeX/Document/iTM2ActionsIndex.xml</ITEM>
    <ITEM KEY="Page_Style/page_numbering/arabic">LaTeX/Document/iTM2ActionsIndex.xml</ITEM>
    <ITEM KEY="Page_Style/page_numbering/roman">LaTeX/Document/iTM2ActionsIndex.xml</ITEM>
    <ITEM KEY="Page_Style/page_numbering/Roman">LaTeX/Document/iTM2ActionsIndex.xml</ITEM>
    <ITEM KEY="Page_Style/page_numbering/alph">LaTeX/Document/iTM2ActionsIndex.xml</ITEM>
    <ITEM KEY="Page_Style/page_numbering/Alph">LaTeX/Document/iTM2ActionsIndex.xml</ITEM>
    <ITEM KEY="Layout">LaTeX/Document/iTM2ActionsIndex.xml</ITEM>
    <ITEM KEY="Layout/landscape">LaTeX/Document/iTM2ActionsIndex.xml</ITEM>
    <ITEM KEY="Layout/Use_lscape_Pkg">LaTeX/Document/iTM2ActionsIndex.xml</ITEM>
    <ITEM KEY="%!iTeXMac">LaTeX/Document/iTM2ActionsIndex.xml</ITEM>
    <ITEM KEY="%!iTeXMac/project">LaTeX/Document/iTM2ActionsIndex.xml</ITEM>
    <ITEM KEY="%!iTeXMac/input">LaTeX/Document/iTM2ActionsIndex.xml</ITEM>
    <ITEM KEY="%!iTeXMac/compile">LaTeX/Document/iTM2ActionsIndex.xml</ITEM>
    <ITEM KEY="%!iTeXMac/typeset">LaTeX/Document/iTM2ActionsIndex.xml</ITEM>
    <ITEM KEY="%!iTeXMac/bibtex">LaTeX/Document/iTM2ActionsIndex.xml</ITEM>
    <ITEM KEY="%!iTeXMac/makeindex">LaTeX/Document/iTM2ActionsIndex.xml</ITEM>
</LIST>